{
  "$schema": "https://raw.githubusercontent.com/max-ieremenko/ThirdPartyLibraries/refs/heads/master/Docs/schema.license-index.json",
  "Code": "CC-BY-3.0",
  "FullName": "Creative Commons Attribution 3.0 Unported",
  "RequiresApproval": true,
  "HRef": "https://spdx.org/licenses/CC-BY-3.0",
  "FileName": "license.txt"
}